{
  "$schema": "https://aoa-agents/schemas/capability-pack.schema.json",
  "id": "repo-refactor.workspace-write",
  "status": "experimental",
  "summary": "Repo-local refactor execution with explicit gates, builders, and validators.",
  "meaning": "Use this pack when an agent may edit repo-local source, schemas, docs, builders, validators, and generated readers under an explicit bounded-change route.",
  "permission_posture": {
    "default_mode": "workspace-write",
    "mutation_allowed": true,
    "requires_gate": true,
    "notes": [
      "Mutation must be repo-local and tied to a named owner surface.",
      "Runtime, service, secret, plugin, hook, and network posture changes need a stronger gate before use."
    ]
  },
  "tool_refs": [
    "apply_patch:repo-local-edits",
    "rg:source-search",
    "git:status-diff-add-commit",
    "python:builders-and-validators"
  ],
  "skill_refs": [
    "aoa-change-protocol",
    "aoa-bounded-context-map",
    "aoa-adr-write",
    "aoa-source-of-truth-check"
  ],
  "technique_refs": [
    "aoa-techniques:bounded-refactor",
    "aoa-techniques:generated-from-source",
    "aoa-techniques:validator-first-closeout"
  ],
  "memory_routes": {
    "read_refs": [
      "aoa-memo:brief",
      "aoa-session-memory:search-readonly"
    ],
    "write_refs": [
      "memo/candidates:write-candidate"
    ],
    "owner": "aoa-memo"
  },
  "proof_routes": [
    "scripts/build_published_surfaces.py",
    "scripts/validate_agent_source_home.py",
    "scripts/validate_agents.py",
    "scripts/release_check.py"
  ],
  "projection_hints": [
    "Suitable for coder specializations that land repo-local changes.",
    "Projection must keep mutation authority narrower than runtime or infrastructure authority."
  ],
  "owner_boundaries": [
    {
      "pressure": "workflow implementation",
      "route": "aoa-skills"
    },
    {
      "pressure": "runtime behavior",
      "route": "abyss-stack"
    },
    {
      "pressure": "proof doctrine",
      "route": "aoa-evals"
    }
  ],
  "stop_lines": [
    "Do not use this pack for service, runtime, network, secret, or plugin mutation without a stronger route.",
    "Do not treat generated reader edits as source truth."
  ]
}
